caption_sentence,cleaned_tokens
,
so let's actually just accuracy is 81.,"['let', 'actually', 'accuracy']"
so let's actually just accuracy is 81.,"['let', 'actually', 'accuracy']"
"so let's actually just
make this five make this five make this five
all right so you know again very similar all right so you know again very similar all right so you know again very similar
numbers we have 82 percent accuracy numbers we have 82 percent accuracy numbers we have 82 percent accuracy
which is pretty decent for a model which is pretty decent for a model which is pretty decent for a model
that's that's that's
relatively simple relatively simple relatively simple
the next type of model that we're going the next type of model that we're going the next type of model that we're going
to talk about is something known as to talk about is something known as to talk about is something known as
naive bayes naive bayes naive bayes
now in order to understand the concepts now in order to understand the concepts now in order to understand the concepts
behind naive bayes we have to be able to behind naive bayes we have to be able to behind naive bayes we have to be able to
understand conditional probability and understand conditional probability and understand conditional probability and
bayes rule bayes rule bayes rule
so so so
let's say i have some sort of data set let's say i have some sort of data set let's say i have some sort of data set
that's shown in this table right here that's shown in this table right here that's shown in this table right here
people who have covid are over here in people who have covid are over here in people who have covid are over here in
this red row and people who do not have this red row and people who do not have this red row and people who do not have
covet are down here in this green row covet are down here in this green row covet are down here in this green row
now what about the cova test well people now what about the cova test well people now what about the cova test well people
who have tested positive who have tested positive who have tested positive
are over here in this column are over here in this column are over here in this column
and people who have tested negative are and people who have tested negative are and people who have tested negative are
over here in this over here in this over here in this
column column column
okay okay okay
yeah so basically our categories are yeah so basically our categories are yeah so basically our categories are
people who have coven and test positive people who have coven and test positive people who have coven and test positive
people who don't have covid but test people who don't have covid but test people who don't have covid but test
positive so a false false positive positive so a false false positive positive so a false false positive
people who have covet and test negative people who have covet and test negative people who have covet and test negative
which is a false negative which is a false negative which is a false negative
and people who don't have covid and test and people who don't have covid and test and people who don't have covid and test
negative which negative which negative which
good means you don't have coven good means you don't have coven good means you don't have coven
okay so let's make this slightly more okay so let's make this slightly more okay so let's make this slightly more
legible and here in the margins i've written and here in the margins i've written
down the sums down the sums down the sums
of of of
whatever it's referring to so this here whatever it's referring to so this here whatever it's referring to so this here
is the sum of this entire row is the sum of this entire row is the sum of this entire row
and this here might be the sum of this and this here might be the sum of this and this here might be the sum of this
column over here column over here column over here
okay okay okay
so the first question that i have is so the first question that i have is so the first question that i have is
what is the probability of having covid what is the probability of having covid what is the probability of having covid
given that you have a positive test given that you have a positive test given that you have a positive test
and in probability we write that out and in probability we write that out and in probability we write that out
like this so the probability like this so the probability like this so the probability
of covid given so this line that vertical line given so this line that vertical line
means means means
given that you know some condition given that you know some condition given that you know some condition
so given a positive test so given a positive test so given a positive test
okay okay okay
so so so
what is the probability of having covid what is the probability of having covid what is the probability of having covid
given a positive test given a positive test given a positive test
so what this is asking is saying okay so what this is asking is saying okay so what this is asking is saying okay
let's go into let's go into let's go into
this condition so the condition of this condition so the condition of this condition so the condition of
having a positive test that is having a positive test that is having a positive test that is
this slice of the data right that means this slice of the data right that means this slice of the data right that means
if you're in this slice of data you have if you're in this slice of data you have if you're in this slice of data you have
a positive test so given that we have a a positive test so given that we have a a positive test so given that we have a
positive test given in this condition in positive test given in this condition in positive test given in this condition in
this circumstance we have a positive this circumstance we have a positive this circumstance we have a positive
test test test
so what's the probability that we have so what's the probability that we have so what's the probability that we have
covid covid covid
well well well
if we're just using this data the number if we're just using this data the number if we're just using this data the number
of people that have covid is 531.","['let', 'actually', 'make', 'five', 'make', 'five', 'make', 'five', 'right', 'know', 'similar', 'right', 'know', 'similar', 'right', 'know', 'similar', 'number', 'percent', 'accuracy', 'number', 'percent', 'accuracy', 'number', 'percent', 'accuracy', 'pretty', 'decent', 'model', 'pretty', 'decent', 'model', 'pretty', 'decent', 'model', 'thats', 'thats', 'thats', 'relatively', 'simple', 'relatively', 'simple', 'relatively', 'simple', 'next', 'type', 'model', 'going', 'next', 'type', 'model', 'going', 'next', 'type', 'model', 'going', 'talk', 'something', 'known', 'talk', 'something', 'known', 'talk', 'something', 'known', 'naive', 'bayes', 'naive', 'bayes', 'naive', 'bayes', 'order', 'understand', 'concept', 'order', 'understand', 'concept', 'order', 'understand', 'concept', 'behind', 'naive', 'bayes', 'able', 'behind', 'naive', 'bayes', 'able', 'behind', 'naive', 'bayes', 'able', 'understand', 'conditional', 'probability', 'understand', 'conditional', 'probability', 'understand', 'conditional', 'probability', 'bayes', 'rule', 'bayes', 'rule', 'bayes', 'rule', 'let', 'say', 'sort', 'data', 'set', 'let', 'say', 'sort', 'data', 'set', 'let', 'say', 'sort', 'data', 'set', 'thats', 'shown', 'table', 'right', 'thats', 'shown', 'table', 'right', 'thats', 'shown', 'table', 'right', 'people', 'covid', 'people', 'covid', 'people', 'covid', 'red', 'row', 'people', 'red', 'row', 'people', 'red', 'row', 'people', 'covet', 'green', 'row', 'covet', 'green', 'row', 'covet', 'green', 'row', 'cova', 'test', 'well', 'people', 'cova', 'test', 'well', 'people', 'cova', 'test', 'well', 'people', 'tested', 'positive', 'tested', 'positive', 'tested', 'positive', 'column', 'column', 'column', 'people', 'tested', 'negative', 'people', 'tested', 'negative', 'people', 'tested', 'negative', 'column', 'column', 'column', 'okay', 'okay', 'okay', 'yeah', 'basically', 'category', 'yeah', 'basically', 'category', 'yeah', 'basically', 'category', 'people', 'coven', 'test', 'positive', 'people', 'coven', 'test', 'positive', 'people', 'coven', 'test', 'positive', 'people', 'dont', 'covid', 'test', 'people', 'dont', 'covid', 'test', 'people', 'dont', 'covid', 'test', 'positive', 'false', 'false', 'positive', 'positive', 'false', 'false', 'positive', 'positive', 'false', 'false', 'positive', 'people', 'covet', 'test', 'negative', 'people', 'covet', 'test', 'negative', 'people', 'covet', 'test', 'negative', 'false', 'negative', 'false', 'negative', 'false', 'negative', 'people', 'dont', 'covid', 'test', 'people', 'dont', 'covid', 'test', 'people', 'dont', 'covid', 'test', 'negative', 'negative', 'negative', 'good', 'mean', 'dont', 'coven', 'good', 'mean', 'dont', 'coven', 'good', 'mean', 'dont', 'coven', 'okay', 'let', 'make', 'slightly', 'okay', 'let', 'make', 'slightly', 'okay', 'let', 'make', 'slightly', 'legible', 'margin', 'ive', 'written', 'margin', 'ive', 'written', 'sum', 'sum', 'sum', 'whatever', 'referring', 'whatever', 'referring', 'whatever', 'referring', 'sum', 'entire', 'row', 'sum', 'entire', 'row', 'sum', 'entire', 'row', 'might', 'sum', 'might', 'sum', 'might', 'sum', 'column', 'column', 'column', 'okay', 'okay', 'okay', 'first', 'question', 'first', 'question', 'first', 'question', 'probability', 'covid', 'probability', 'covid', 'probability', 'covid', 'given', 'positive', 'test', 'given', 'positive', 'test', 'given', 'positive', 'test', 'probability', 'write', 'probability', 'write', 'probability', 'write', 'like', 'probability', 'like', 'probability', 'like', 'probability', 'covid', 'given', 'line', 'vertical', 'line', 'given', 'line', 'vertical', 'line', 'mean', 'mean', 'mean', 'given', 'know', 'condition', 'given', 'know', 'condition', 'given', 'know', 'condition', 'given', 'positive', 'test', 'given', 'positive', 'test', 'given', 'positive', 'test', 'okay', 'okay', 'okay', 'probability', 'covid', 'probability', 'covid', 'probability', 'covid', 'given', 'positive', 'test', 'given', 'positive', 'test', 'given', 'positive', 'test', 'asking', 'saying', 'okay', 'asking', 'saying', 'okay', 'asking', 'saying', 'okay', 'let', 'let', 'let', 'condition', 'condition', 'condition', 'condition', 'condition', 'condition', 'positive', 'test', 'positive', 'test', 'positive', 'test', 'slice', 'data', 'right', 'mean', 'slice', 'data', 'right', 'mean', 'slice', 'data', 'right', 'mean', 'youre', 'slice', 'data', 'youre', 'slice', 'data', 'youre', 'slice', 'data', 'positive', 'test', 'given', 'positive', 'test', 'given', 'positive', 'test', 'given', 'positive', 'test', 'given', 'condition', 'positive', 'test', 'given', 'condition', 'positive', 'test', 'given', 'condition', 'circumstance', 'positive', 'circumstance', 'positive', 'circumstance', 'positive', 'test', 'test', 'test', 'whats', 'probability', 'whats', 'probability', 'whats', 'probability', 'covid', 'covid', 'covid', 'well', 'well', 'well', 'using', 'data', 'number', 'using', 'data', 'number', 'using', 'data', 'number', 'people', 'covid']"
of people that have covid is 531.,"['people', 'covid']"
