caption_sentence,cleaned_tokens
equal to let's say 32.,"['equal', 'let', 'say']"
"equal to let's say 32.
all right um all right um all right um
and the validation split so what the validation split does if so what the validation split does if
it's down here somewhere it's down here somewhere it's down here somewhere
okay so yeah this validation split is okay so yeah this validation split is okay so yeah this validation split is
just the fraction the training data to just the fraction the training data to just the fraction the training data to
be used as validation data be used as validation data be used as validation data
so essentially every single epoch what's so essentially every single epoch what's so essentially every single epoch what's
going on is going on is going on is
uh tensorflow saying leave certain if if uh tensorflow saying leave certain if if uh tensorflow saying leave certain if if
this is 0.2 then leave 20 this is 0.2 then leave 20 this is 0.2 then leave 20
out and we're going to test how the out and we're going to test how the out and we're going to test how the
model performs on that 20 that we've model performs on that 20 that we've model performs on that 20 that we've
left out left out left out
okay so it's basically like our okay so it's basically like our okay so it's basically like our
validation data set but validation data set but validation data set but
um tensorflow does it on our training um tensorflow does it on our training um tensorflow does it on our training
data set during the training so we have data set during the training so we have data set during the training so we have
now a measure outside of just our now a measure outside of just our now a measure outside of just our
validation data set to see you know validation data set to see you know validation data set to see you know
what's going on what's going on what's going on
so validation split i'm going to make so validation split i'm going to make so validation split i'm going to make
that 0.2 that 0.2 that 0.2
and we can run this so if i run that set verbose set verbose
equal to zero which means okay don't equal to zero which means okay don't equal to zero which means okay don't
print anything because printing print anything because printing print anything because printing
something for 100 epochs might get kind something for 100 epochs might get kind something for 100 epochs might get kind
of annoying of annoying of annoying
so i'm just gonna let it run so i'm just gonna let it run so i'm just gonna let it run
let it train and then we'll see what let it train and then we'll see what let it train and then we'll see what
happens cool so it finished training and now cool so it finished training and now
what i can do is because you know i've what i can do is because you know i've what i can do is because you know i've
already defined these two functions already defined these two functions already defined these two functions
i can go ahead and i can plot the loss i can go ahead and i can plot the loss i can go ahead and i can plot the loss
oops oops oops
plot loss of that history plot loss of that history plot loss of that history
and i can also plot the accuracy and i can also plot the accuracy and i can also plot the accuracy
throughout throughout throughout
the training the training the training
so so so
this is a little bit ish what we're this is a little bit ish what we're this is a little bit ish what we're
looking for we definitely are looking looking for we definitely are looking looking for we definitely are looking
for a steadily decreasing loss for a steadily decreasing loss for a steadily decreasing loss
and an increasing accuracy so here we do and an increasing accuracy so here we do and an increasing accuracy so here we do
see that you know our validation see that you know our validation see that you know our validation
accuracy improves from accuracy improves from accuracy improves from
uh around point seven uh around point seven uh around point seven
seven or something all the way up to seven or something all the way up to seven or something all the way up to
somewhere around point maybe eight one somewhere around point maybe eight one somewhere around point maybe eight one
and our loss is decreasing so this is and our loss is decreasing so this is and our loss is decreasing so this is
good good good
it is expected that the validation loss it is expected that the validation loss it is expected that the validation loss
and accuracy is performing worse than um and accuracy is performing worse than um and accuracy is performing worse than um
the training loss or accuracy and that's the training loss or accuracy and that's the training loss or accuracy and that's
because our model is training on that because our model is training on that because our model is training on that
data so it's adapting to that data data so it's adapting to that data data so it's adapting to that data
whereas the validation stuff is you know whereas the validation stuff is you know whereas the validation stuff is you know
stuff that it hasn't seen yet so stuff that it hasn't seen yet so stuff that it hasn't seen yet so
so that's why so that's why so that's why
so in machine learning as we saw above so in machine learning as we saw above so in machine learning as we saw above
we could change a bunch of the we could change a bunch of the we could change a bunch of the
parameters right like i could change parameters right like i could change parameters right like i could change
this to 64.","['equal', 'let', 'say', 'right', 'right', 'right', 'validation', 'split', 'validation', 'split', 'validation', 'split', 'somewhere', 'somewhere', 'somewhere', 'okay', 'yeah', 'validation', 'split', 'okay', 'yeah', 'validation', 'split', 'okay', 'yeah', 'validation', 'split', 'fraction', 'training', 'data', 'fraction', 'training', 'data', 'fraction', 'training', 'data', 'used', 'validation', 'data', 'used', 'validation', 'data', 'used', 'validation', 'data', 'essentially', 'every', 'single', 'epoch', 'whats', 'essentially', 'every', 'single', 'epoch', 'whats', 'essentially', 'every', 'single', 'epoch', 'whats', 'going', 'going', 'going', 'tensorflow', 'saying', 'leave', 'certain', 'tensorflow', 'saying', 'leave', 'certain', 'tensorflow', 'saying', 'leave', 'certain', 'leave', 'leave', 'leave', 'going', 'test', 'going', 'test', 'going', 'test', 'model', 'performs', 'weve', 'model', 'performs', 'weve', 'model', 'performs', 'weve', 'left', 'left', 'left', 'okay', 'basically', 'like', 'okay', 'basically', 'like', 'okay', 'basically', 'like', 'validation', 'data', 'set', 'validation', 'data', 'set', 'validation', 'data', 'set', 'tensorflow', 'training', 'tensorflow', 'training', 'tensorflow', 'training', 'data', 'set', 'training', 'data', 'set', 'training', 'data', 'set', 'training', 'measure', 'outside', 'measure', 'outside', 'measure', 'outside', 'validation', 'data', 'set', 'see', 'know', 'validation', 'data', 'set', 'see', 'know', 'validation', 'data', 'set', 'see', 'know', 'whats', 'going', 'whats', 'going', 'whats', 'going', 'validation', 'split', 'going', 'make', 'validation', 'split', 'going', 'make', 'validation', 'split', 'going', 'make', 'run', 'run', 'set', 'verbose', 'set', 'verbose', 'equal', 'zero', 'mean', 'okay', 'dont', 'equal', 'zero', 'mean', 'okay', 'dont', 'equal', 'zero', 'mean', 'okay', 'dont', 'print', 'anything', 'printing', 'print', 'anything', 'printing', 'print', 'anything', 'printing', 'something', 'epoch', 'might', 'get', 'kind', 'something', 'epoch', 'might', 'get', 'kind', 'something', 'epoch', 'might', 'get', 'kind', 'annoying', 'annoying', 'annoying', 'gon', 'let', 'run', 'gon', 'let', 'run', 'gon', 'let', 'run', 'let', 'train', 'well', 'see', 'let', 'train', 'well', 'see', 'let', 'train', 'well', 'see', 'happens', 'cool', 'finished', 'training', 'cool', 'finished', 'training', 'know', 'ive', 'know', 'ive', 'know', 'ive', 'already', 'defined', 'two', 'function', 'already', 'defined', 'two', 'function', 'already', 'defined', 'two', 'function', 'ahead', 'plot', 'loss', 'ahead', 'plot', 'loss', 'ahead', 'plot', 'loss', 'oops', 'oops', 'oops', 'plot', 'loss', 'history', 'plot', 'loss', 'history', 'plot', 'loss', 'history', 'also', 'plot', 'accuracy', 'also', 'plot', 'accuracy', 'also', 'plot', 'accuracy', 'throughout', 'throughout', 'throughout', 'training', 'training', 'training', 'little', 'bit', 'ish', 'little', 'bit', 'ish', 'little', 'bit', 'ish', 'looking', 'definitely', 'looking', 'looking', 'definitely', 'looking', 'looking', 'definitely', 'looking', 'steadily', 'decreasing', 'loss', 'steadily', 'decreasing', 'loss', 'steadily', 'decreasing', 'loss', 'increasing', 'accuracy', 'increasing', 'accuracy', 'increasing', 'accuracy', 'see', 'know', 'validation', 'see', 'know', 'validation', 'see', 'know', 'validation', 'accuracy', 'improves', 'accuracy', 'improves', 'accuracy', 'improves', 'around', 'point', 'seven', 'around', 'point', 'seven', 'around', 'point', 'seven', 'seven', 'something', 'way', 'seven', 'something', 'way', 'seven', 'something', 'way', 'somewhere', 'around', 'point', 'maybe', 'eight', 'one', 'somewhere', 'around', 'point', 'maybe', 'eight', 'one', 'somewhere', 'around', 'point', 'maybe', 'eight', 'one', 'loss', 'decreasing', 'loss', 'decreasing', 'loss', 'decreasing', 'good', 'good', 'good', 'expected', 'validation', 'loss', 'expected', 'validation', 'loss', 'expected', 'validation', 'loss', 'accuracy', 'performing', 'worse', 'accuracy', 'performing', 'worse', 'accuracy', 'performing', 'worse', 'training', 'loss', 'accuracy', 'thats', 'training', 'loss', 'accuracy', 'thats', 'training', 'loss', 'accuracy', 'thats', 'model', 'training', 'model', 'training', 'model', 'training', 'data', 'adapting', 'data', 'data', 'adapting', 'data', 'data', 'adapting', 'data', 'whereas', 'validation', 'stuff', 'know', 'whereas', 'validation', 'stuff', 'know', 'whereas', 'validation', 'stuff', 'know', 'stuff', 'hasnt', 'seen', 'yet', 'stuff', 'hasnt', 'seen', 'yet', 'stuff', 'hasnt', 'seen', 'yet', 'thats', 'thats', 'thats', 'machine', 'learning', 'saw', 'machine', 'learning', 'saw', 'machine', 'learning', 'saw', 'could', 'change', 'bunch', 'could', 'change', 'bunch', 'could', 'change', 'bunch', 'parameter', 'right', 'like', 'could', 'change', 'parameter', 'right', 'like', 'could', 'change', 'parameter', 'right', 'like', 'could', 'change']"
so now it'd be a row of 64 this to 64.,"['itd', 'row']"
so now it'd be a row of 64 this to 64.,"['itd', 'row']"
"so now it'd be a row of 64
nodes and then 32 and then one nodes and then 32 and then one nodes and then 32 and then one
so i can change some of these parameters so i can change some of these parameters so i can change some of these parameters
and and and
a lot of machine learning is trying to a lot of machine learning is trying to a lot of machine learning is trying to
find hey what do we set these hyper find hey what do we set these hyper find hey what do we set these hyper
parameters to parameters to parameters to
so what i'm actually going to do is i'm so what i'm actually going to do is i'm so what i'm actually going to do is i'm
going to rewrite this so that going to rewrite this so that going to rewrite this so that
we can do something what's known as a we can do something what's known as a we can do something what's known as a
grid search so we can search through an grid search so we can search through an grid search so we can search through an
entire space of hey what happens if entire space of hey what happens if entire space of hey what happens if
you know we you know we you know we
have 64 nodes and 64 nodes or 16 nodes have 64 nodes and 64 nodes or 16 nodes have 64 nodes and 64 nodes or 16 nodes
and 16 nodes and 16 nodes and 16 nodes
and so on and so on and so on
um and then on top of all that we can um and then on top of all that we can um and then on top of all that we can
you know we can change you know we can change you know we can change
this uh this uh this uh
learning rate we can change how many learning rate we can change how many learning rate we can change how many
epochs we can change epochs we can change epochs we can change
you know the batch size all these things you know the batch size all these things you know the batch size all these things
might affect our training might affect our training might affect our training
and and and
just for kicks i'm also going to add just for kicks i'm also going to add just for kicks i'm also going to add
what's known as a dropout layer in here and what dropout is doing is saying hey and what dropout is doing is saying hey
randomly choose randomly choose randomly choose
with at this rate certain nodes with at this rate certain nodes with at this rate certain nodes
and don't train them and don't train them and don't train them
in you know a certain iteration so this in you know a certain iteration so this in you know a certain iteration so this
helps prevent overfitting helps prevent overfitting helps prevent overfitting
okay okay okay
so so so
i'm actually going to i'm actually going to i'm actually going to
define this define this define this
as a function called train model we're as a function called train model we're as a function called train model we're
going to pass an x train y train going to pass an x train y train going to pass an x train y train
um the number of um the number of um the number of
nodes nodes nodes
uh the drop out uh the drop out uh the drop out
you know the probability that we just you know the probability that we just you know the probability that we just
talked about talked about talked about
um um um
learning rate learning rate learning rate
so i'm actually going to say lr so i'm actually going to say lr so i'm actually going to say lr
batch size batch size batch size
and and and
we can also pass the number of epochs we can also pass the number of epochs we can also pass the number of epochs
right i mentioned that as a parameter right i mentioned that as a parameter right i mentioned that as a parameter
so indent this so it goes under here and so indent this so it goes under here and so indent this so it goes under here and
with these two i'm going to set this with these two i'm going to set this with these two i'm going to set this
equal to number of nodes equal to number of nodes equal to number of nodes
and now with the two dropout layers i'm and now with the two dropout layers i'm and now with the two dropout layers i'm
going to set dropout prob so now you going to set dropout prob so now you going to set dropout prob so now you
know the probability of know the probability of know the probability of
turning off a node during the training turning off a node during the training turning off a node during the training
is equal to dropout prop is equal to dropout prop is equal to dropout prop
um and i'm going to keep the output um and i'm going to keep the output um and i'm going to keep the output
layer the same layer the same layer the same
now i'm compiling it but this here is now i'm compiling it but this here is now i'm compiling it but this here is
now going to be my learning rate now going to be my learning rate now going to be my learning rate
and i still want binary cross entropy and i still want binary cross entropy and i still want binary cross entropy
and accuracy and accuracy and accuracy
we are actually going to train we are actually going to train we are actually going to train
our model inside of our model inside of our model inside of
this this this
function function function
but here we can do the epochs equals but here we can do the epochs equals but here we can do the epochs equals
epochs and this is equal to whatever you epochs and this is equal to whatever you epochs and this is equal to whatever you
know we're passing in know we're passing in know we're passing in
uh x train y train belong right here uh x train y train belong right here uh x train y train belong right here
okay so those are getting passed in as okay so those are getting passed in as okay so those are getting passed in as
well well well
and finally at the end i'm going to and finally at the end i'm going to and finally at the end i'm going to
return this model and the history of return this model and the history of return this model and the history of
that model okay okay
so is let's just go through all of these so is let's just go through all of these so
let's say let's keep the epochs at 100.","['itd', 'row', 'node', 'one', 'node', 'one', 'node', 'one', 'change', 'parameter', 'change', 'parameter', 'change', 'parameter', 'lot', 'machine', 'learning', 'trying', 'lot', 'machine', 'learning', 'trying', 'lot', 'machine', 'learning', 'trying', 'find', 'hey', 'set', 'hyper', 'find', 'hey', 'set', 'hyper', 'find', 'hey', 'set', 'hyper', 'parameter', 'parameter', 'parameter', 'actually', 'going', 'actually', 'going', 'actually', 'going', 'going', 'rewrite', 'going', 'rewrite', 'going', 'rewrite', 'something', 'whats', 'known', 'something', 'whats', 'known', 'something', 'whats', 'known', 'grid', 'search', 'search', 'grid', 'search', 'search', 'grid', 'search', 'search', 'entire', 'space', 'hey', 'happens', 'entire', 'space', 'hey', 'happens', 'entire', 'space', 'hey', 'happens', 'know', 'know', 'know', 'node', 'node', 'node', 'node', 'node', 'node', 'node', 'node', 'node', 'node', 'node', 'node', 'top', 'top', 'top', 'know', 'change', 'know', 'change', 'know', 'change', 'learning', 'rate', 'change', 'many', 'learning', 'rate', 'change', 'many', 'learning', 'rate', 'change', 'many', 'epoch', 'change', 'epoch', 'change', 'epoch', 'change', 'know', 'batch', 'size', 'thing', 'know', 'batch', 'size', 'thing', 'know', 'batch', 'size', 'thing', 'might', 'affect', 'training', 'might', 'affect', 'training', 'might', 'affect', 'training', 'kick', 'also', 'going', 'add', 'kick', 'also', 'going', 'add', 'kick', 'also', 'going', 'add', 'whats', 'known', 'dropout', 'layer', 'dropout', 'saying', 'hey', 'dropout', 'saying', 'hey', 'randomly', 'choose', 'randomly', 'choose', 'randomly', 'choose', 'rate', 'certain', 'node', 'rate', 'certain', 'node', 'rate', 'certain', 'node', 'dont', 'train', 'dont', 'train', 'dont', 'train', 'know', 'certain', 'iteration', 'know', 'certain', 'iteration', 'know', 'certain', 'iteration', 'help', 'prevent', 'overfitting', 'help', 'prevent', 'overfitting', 'help', 'prevent', 'overfitting', 'okay', 'okay', 'okay', 'actually', 'going', 'actually', 'going', 'actually', 'going', 'define', 'define', 'define', 'function', 'called', 'train', 'model', 'function', 'called', 'train', 'model', 'function', 'called', 'train', 'model', 'going', 'pas', 'train', 'train', 'going', 'pas', 'train', 'train', 'going', 'pas', 'train', 'train', 'number', 'number', 'number', 'node', 'node', 'node', 'drop', 'drop', 'drop', 'know', 'probability', 'know', 'probability', 'know', 'probability', 'talked', 'talked', 'talked', 'learning', 'rate', 'learning', 'rate', 'learning', 'rate', 'actually', 'going', 'say', 'actually', 'going', 'say', 'actually', 'going', 'say', 'batch', 'size', 'batch', 'size', 'batch', 'size', 'also', 'pas', 'number', 'epoch', 'also', 'pas', 'number', 'epoch', 'also', 'pas', 'number', 'epoch', 'right', 'mentioned', 'parameter', 'right', 'mentioned', 'parameter', 'right', 'mentioned', 'parameter', 'indent', 'go', 'indent', 'go', 'indent', 'go', 'two', 'going', 'set', 'two', 'going', 'set', 'two', 'going', 'set', 'equal', 'number', 'node', 'equal', 'number', 'node', 'equal', 'number', 'node', 'two', 'dropout', 'layer', 'two', 'dropout', 'layer', 'two', 'dropout', 'layer', 'going', 'set', 'dropout', 'prob', 'going', 'set', 'dropout', 'prob', 'going', 'set', 'dropout', 'prob', 'know', 'probability', 'know', 'probability', 'know', 'probability', 'turning', 'node', 'training', 'turning', 'node', 'training', 'turning', 'node', 'training', 'equal', 'dropout', 'prop', 'equal', 'dropout', 'prop', 'equal', 'dropout', 'prop', 'going', 'keep', 'output', 'going', 'keep', 'output', 'going', 'keep', 'output', 'layer', 'layer', 'layer', 'compiling', 'compiling', 'compiling', 'going', 'learning', 'rate', 'going', 'learning', 'rate', 'going', 'learning', 'rate', 'still', 'want', 'binary', 'cross', 'entropy', 'still', 'want', 'binary', 'cross', 'entropy', 'still', 'want', 'binary', 'cross', 'entropy', 'accuracy', 'accuracy', 'accuracy', 'actually', 'going', 'train', 'actually', 'going', 'train', 'actually', 'going', 'train', 'model', 'inside', 'model', 'inside', 'model', 'inside', 'function', 'function', 'function', 'epoch', 'equal', 'epoch', 'equal', 'epoch', 'equal', 'epoch', 'equal', 'whatever', 'epoch', 'equal', 'whatever', 'epoch', 'equal', 'whatever', 'know', 'passing', 'know', 'passing', 'know', 'passing', 'train', 'train', 'belong', 'right', 'train', 'train', 'belong', 'right', 'train', 'train', 'belong', 'right', 'okay', 'getting', 'passed', 'okay', 'getting', 'passed', 'okay', 'getting', 'passed', 'well', 'well', 'well', 'finally', 'end', 'going', 'finally', 'end', 'going', 'finally', 'end', 'going', 'return', 'model', 'history', 'return', 'model', 'history', 'return', 'model', 'history', 'model', 'okay', 'okay', 'let', 'let', 'let', 'say', 'let', 'keep', 'epoch']"
let's say let's keep the epochs at 100.,"['let', 'say', 'let', 'keep', 'epoch']"
"let's say let's keep the epochs at 100.
and now what i can do is i can say hey and now what i can do is i can say hey and now what i can do is i can say hey
for a number of nodes in for a number of nodes in for a number of nodes in
let's say let's do 16 32 and 64 to see let's say let's do 16 32 and 64 to see let's say let's do 16 32 and 64 to see
what happens what happens what happens
for the different dropout for the different dropout for the different dropout
probabilities in probabilities in probabilities in
i mean zero would be nothing let's use i mean zero would be nothing let's use i mean zero would be nothing let's use
0.2 also to see what happens 0.2 also to see what happens 0.2 also to see what happens
um you know for the learning rate in you know for the learning rate in
uh uh uh
0.005 0.005 0.005
0.001 0.001 0.001
and you know maybe we want to throw on and you know maybe we want to throw on and you know maybe we want to throw on
0.1 in there as well and then for the batch size uh let's do and then for the batch size uh let's do
16 32 64 as well actually and let's also 16 32 64 as well actually and let's also 16 32 64 as well actually and let's also
throw in 128.","['let', 'say', 'let', 'keep', 'epoch', 'say', 'hey', 'say', 'hey', 'say', 'hey', 'number', 'node', 'number', 'node', 'number', 'node', 'let', 'say', 'let', 'see', 'let', 'say', 'let', 'see', 'let', 'say', 'let', 'see', 'happens', 'happens', 'happens', 'different', 'dropout', 'different', 'dropout', 'different', 'dropout', 'probability', 'probability', 'probability', 'mean', 'zero', 'would', 'nothing', 'let', 'use', 'mean', 'zero', 'would', 'nothing', 'let', 'use', 'mean', 'zero', 'would', 'nothing', 'let', 'use', 'also', 'see', 'happens', 'also', 'see', 'happens', 'also', 'see', 'happens', 'know', 'learning', 'rate', 'know', 'learning', 'rate', 'know', 'maybe', 'want', 'throw', 'know', 'maybe', 'want', 'throw', 'know', 'maybe', 'want', 'throw', 'well', 'batch', 'size', 'let', 'batch', 'size', 'let', 'well', 'actually', 'let', 'also', 'well', 'actually', 'let', 'also', 'well', 'actually', 'let', 'also', 'throw']"
actually let's get rid of throw in 128.,"['actually', 'let', 'get', 'rid', 'throw']"
actually let's get rid of throw in 128.,"['actually', 'let', 'get', 'rid', 'throw']"
"actually let's get rid of
16.","['actually', 'let', 'get', 'rid']"
sorry 16.,['sorry']
sorry 16.,['sorry']
