caption_sentence,cleaned_tokens
1,[]
"1.
so here let's rewrite this so here let's rewrite this so here let's rewrite this
as p equals mx as p equals mx as p equals mx
plus b okay well mx plus b that can range okay well mx plus b that can range
you know from negative infinity to you know from negative infinity to you know from negative infinity to
infinity right for any for any value of infinity right for any for any value of infinity right for any for any value of
x it goes from negative infinity to x it goes from negative infinity to x it goes from negative infinity to
infinity infinity infinity
but probability we know probably one of but probability we know probably one of but probability we know probably one of
the rules of probability is that the rules of probability is that the rules of probability is that
probability has to stay between zero and probability has to stay between zero and probability has to stay between zero and
one one one
so how do we fix this so how do we fix this so how do we fix this
well maybe instead of well maybe instead of well maybe instead of
just setting the probability equal to just setting the probability equal to just setting the probability equal to
that we can set the odds that we can set the odds that we can set the odds
equal to this so by that i mean okay equal to this so by that i mean okay equal to this so by that i mean okay
let's do probability divided by 1 minus let's do probability divided by 1 minus let's do probability divided by 1 minus
the probability okay so now it becomes the probability okay so now it becomes the probability okay so now it becomes
this ratio this ratio this ratio
now this ratio is allowed to take on now this ratio is allowed to take on now this ratio is allowed to take on
infinite values infinite values infinite values
but there's still one issue here but there's still one issue here but there's still one issue here
let me move this over a bit let me move this over a bit let me move this over a bit
the one issue here is that the one issue here is that the one issue here is that
mx plus b that can still be negative mx plus b that can still be negative mx plus b that can still be negative
right like if you know i have a negative right like if you know i have a negative right like if you know i have a negative
slope if i have a negative b if i have slope if i have a negative b if i have slope if i have a negative b if i have
some negative x's in there i don't know some negative x's in there i don't know some negative x's in there i don't know
but that can be that's allowed to be but that can be that's allowed to be but that can be that's allowed to be
negative negative negative
so how do we fix that so how do we fix that so how do we fix that
we do that by actually taking the log we do that by actually taking the log we do that by actually taking the log
of the odds of the odds of the odds
okay so now i have the log of you know some so now i have the log of you know some
probability divided by 1 minus the probability divided by 1 minus the probability divided by 1 minus the
probability and now that is on a range probability and now that is on a range probability and now that is on a range
of negative infinity to infinity which of negative infinity to infinity which of negative infinity to infinity which
is good because the range of log should is good because the range of log should is good because the range of log should
be negative infinity to infinity be negative infinity to infinity be negative infinity to infinity
now how do i solve for p the probability now how do i solve for p the probability now how do i solve for p the probability
well the first thing i can do is take well the first thing i can do is take well the first thing i can do is take
you know you know you know
i can remove the log by taking the not i can remove the log by taking the not i can remove the log by taking the not
the um the um the um
e to the whatever is on both sides e to the whatever is on both sides e to the whatever is on both sides
so that gives me the probability so that gives me the probability so that gives me the probability
over the one minus the probability over the one minus the probability over the one minus the probability
is now equal to e to the m x plus b is now equal to e to the m x plus b is now equal to e to the m x plus b
okay okay okay
so let's multiply that out so the so let's multiply that out so the so let's multiply that out so the
probability is equal to probability is equal to probability is equal to
one minus probability e to the m x plus one minus probability e to the m x plus one minus probability e to the m x plus
b b b
so p is equal to e to the m x plus b so p is equal to e to the m x plus b so p is equal to e to the m x plus b
minus p minus p minus p
times e to the m x plus b times e to the m x plus b times e to the m x plus b
and now we have we can move like terms and now we have we can move like terms and now we have we can move like terms
to one side so if i do p to one side so if i do p to one side so if i do p
uh so basically i'm moving this over so uh so basically i'm moving this over so uh so basically i'm moving this over so
i'm adding p so now p one plus i'm adding p so now p one plus i'm adding p so now p one plus
e to the m x plus b e to the m x plus b e to the m x plus b
is equal to is equal to is equal to
e to the m x plus b and let me change e to the m x plus b and let me change e to the m x plus b and let me change
this parenthesis make it a little bigger this parenthesis make it a little bigger this parenthesis make it a little bigger
so now my probability can be e to the mx so now my probability can be e to the mx so now my probability can be e to the mx
plus b plus b plus b
divided by 1 plus e to the mx divided by 1 plus e to the mx divided by 1 plus e to the mx
plus b okay okay
well well well
let me just rewrite this really quickly let me just rewrite this really quickly let me just rewrite this really quickly
i want a numerator of one on top i want a numerator of one on top i want a numerator of one on top
okay so what i'm going to do is i'm okay so what i'm going to do is i'm okay so what i'm going to do is i'm
going to multiply going to multiply going to multiply
this by negative mx plus b this by negative mx plus b this by negative mx plus b
and then also the bottom by negative mx and then also the bottom by negative mx and then also the bottom by negative mx
plus b and i'm allowed to do that plus b and i'm allowed to do that plus b and i'm allowed to do that
because because because
this over this is 1.","['let', 'rewrite', 'let', 'rewrite', 'let', 'rewrite', 'equal', 'equal', 'equal', 'plus', 'okay', 'well', 'plus', 'range', 'okay', 'well', 'plus', 'range', 'know', 'negative', 'infinity', 'know', 'negative', 'infinity', 'know', 'negative', 'infinity', 'infinity', 'right', 'value', 'infinity', 'right', 'value', 'infinity', 'right', 'value', 'go', 'negative', 'infinity', 'go', 'negative', 'infinity', 'go', 'negative', 'infinity', 'infinity', 'infinity', 'infinity', 'probability', 'know', 'probably', 'one', 'probability', 'know', 'probably', 'one', 'probability', 'know', 'probably', 'one', 'rule', 'probability', 'rule', 'probability', 'rule', 'probability', 'probability', 'stay', 'zero', 'probability', 'stay', 'zero', 'probability', 'stay', 'zero', 'one', 'one', 'one', 'fix', 'fix', 'fix', 'well', 'maybe', 'instead', 'well', 'maybe', 'instead', 'well', 'maybe', 'instead', 'setting', 'probability', 'equal', 'setting', 'probability', 'equal', 'setting', 'probability', 'equal', 'set', 'odds', 'set', 'odds', 'set', 'odds', 'equal', 'mean', 'okay', 'equal', 'mean', 'okay', 'equal', 'mean', 'okay', 'let', 'probability', 'divided', 'minus', 'let', 'probability', 'divided', 'minus', 'let', 'probability', 'divided', 'minus', 'probability', 'okay', 'becomes', 'probability', 'okay', 'becomes', 'probability', 'okay', 'becomes', 'ratio', 'ratio', 'ratio', 'ratio', 'allowed', 'take', 'ratio', 'allowed', 'take', 'ratio', 'allowed', 'take', 'infinite', 'value', 'infinite', 'value', 'infinite', 'value', 'there', 'still', 'one', 'issue', 'there', 'still', 'one', 'issue', 'there', 'still', 'one', 'issue', 'let', 'move', 'bit', 'let', 'move', 'bit', 'let', 'move', 'bit', 'one', 'issue', 'one', 'issue', 'one', 'issue', 'plus', 'still', 'negative', 'plus', 'still', 'negative', 'plus', 'still', 'negative', 'right', 'like', 'know', 'negative', 'right', 'like', 'know', 'negative', 'right', 'like', 'know', 'negative', 'slope', 'negative', 'slope', 'negative', 'slope', 'negative', 'negative', 'dont', 'know', 'negative', 'dont', 'know', 'negative', 'dont', 'know', 'thats', 'allowed', 'thats', 'allowed', 'thats', 'allowed', 'negative', 'negative', 'negative', 'fix', 'fix', 'fix', 'actually', 'taking', 'log', 'actually', 'taking', 'log', 'actually', 'taking', 'log', 'odds', 'odds', 'odds', 'okay', 'log', 'know', 'log', 'know', 'probability', 'divided', 'minus', 'probability', 'divided', 'minus', 'probability', 'divided', 'minus', 'probability', 'range', 'probability', 'range', 'probability', 'range', 'negative', 'infinity', 'infinity', 'negative', 'infinity', 'infinity', 'negative', 'infinity', 'infinity', 'good', 'range', 'log', 'good', 'range', 'log', 'good', 'range', 'log', 'negative', 'infinity', 'infinity', 'negative', 'infinity', 'infinity', 'negative', 'infinity', 'infinity', 'solve', 'probability', 'solve', 'probability', 'solve', 'probability', 'well', 'first', 'thing', 'take', 'well', 'first', 'thing', 'take', 'well', 'first', 'thing', 'take', 'know', 'know', 'know', 'remove', 'log', 'taking', 'remove', 'log', 'taking', 'remove', 'log', 'taking', 'whatever', 'side', 'whatever', 'side', 'whatever', 'side', 'give', 'probability', 'give', 'probability', 'give', 'probability', 'one', 'minus', 'probability', 'one', 'minus', 'probability', 'one', 'minus', 'probability', 'equal', 'plus', 'equal', 'plus', 'equal', 'plus', 'okay', 'okay', 'okay', 'let', 'multiply', 'let', 'multiply', 'let', 'multiply', 'probability', 'equal', 'probability', 'equal', 'probability', 'equal', 'one', 'minus', 'probability', 'plus', 'one', 'minus', 'probability', 'plus', 'one', 'minus', 'probability', 'plus', 'equal', 'plus', 'equal', 'plus', 'equal', 'plus', 'minus', 'minus', 'minus', 'time', 'plus', 'time', 'plus', 'time', 'plus', 'move', 'like', 'term', 'move', 'like', 'term', 'move', 'like', 'term', 'one', 'side', 'one', 'side', 'one', 'side', 'basically', 'moving', 'basically', 'moving', 'basically', 'moving', 'adding', 'one', 'plus', 'adding', 'one', 'plus', 'adding', 'one', 'plus', 'plus', 'plus', 'plus', 'equal', 'equal', 'equal', 'plus', 'let', 'change', 'plus', 'let', 'change', 'plus', 'let', 'change', 'parenthesis', 'make', 'little', 'bigger', 'parenthesis', 'make', 'little', 'bigger', 'parenthesis', 'make', 'little', 'bigger', 'probability', 'probability', 'probability', 'plus', 'plus', 'plus', 'divided', 'plus', 'divided', 'plus', 'divided', 'plus', 'plus', 'okay', 'okay', 'well', 'well', 'well', 'let', 'rewrite', 'really', 'quickly', 'let', 'rewrite', 'really', 'quickly', 'let', 'rewrite', 'really', 'quickly', 'want', 'numerator', 'one', 'top', 'want', 'numerator', 'one', 'top', 'want', 'numerator', 'one', 'top', 'okay', 'going', 'okay', 'going', 'okay', 'going', 'going', 'multiply', 'going', 'multiply', 'going', 'multiply', 'negative', 'plus', 'negative', 'plus', 'negative', 'plus', 'also', 'bottom', 'negative', 'also', 'bottom', 'negative', 'also', 'bottom', 'negative', 'plus', 'allowed', 'plus', 'allowed', 'plus', 'allowed']"
this over this is 1.,[]
